{
  "customerId": "CUST123",
  "items": [
    { "productId": "978-1491904244", "quantity": 2, "unitPrice": 59.99 },
    { "productId": "978-0132350884", "quantity": 1, "unitPrice": 49.99 }
  ],
  "shippingAddress": {
    "name": "Jane Doe",
    "line1": "123 Main St",
    "city": "Seattle",
    "state": "WA",
    "postalCode": "98101",
    "country": "US"
  },
  "currency": "USD",
  "paymentMethod": { "type": "CARD", "token": "tok_abc123" },
  "notes": "Leave at reception"
}